"goHallmarkId","goHallmark","goHallmarkTerm","goId","goTerm"
"GO:0006955","Immune response","immune response","GO:0002367","cytokine production involved in immune response"
"GO:0006955","Immune response","immune response","GO:0002368","B cell cytokine production"
"GO:0006955","Immune response","immune response","GO:0002369","T cell cytokine production"
"GO:0006955","Immune response","immune response","GO:0002370","natural killer cell cytokine production"
"GO:0006955","Immune response","immune response","GO:0002371","dendritic cell cytokine production"
"GO:0006955","Immune response","immune response","GO:0002372","myeloid dendritic cell cytokine production"
"GO:0006955","Immune response","immune response","GO:0002373","plasmacytoid dendritic cell cytokine production"
"GO:0006955","Immune response","immune response","GO:0002374","cytokine secretion involved in immune response"
"GO:0006955","Immune response","immune response","GO:0002375","cytokine biosynthetic process involved in immune response"
"GO:0006955","Immune response","immune response","GO:0002379","immunoglobulin biosynthetic process involved in immune response"
"GO:0006955","Immune response","immune response","GO:0002380","immunoglobulin secretion involved in immune response"
"GO:0006955","Immune response","immune response","GO:0002381","immunoglobulin production involved in immunoglobulin mediated immune response"
"GO:0006955","Immune response","immune response","GO:0002383","immune response in brain or nervous system"
"GO:0006955","Immune response","immune response","GO:0002384","hepatic immune response"
"GO:0006955","Immune response","immune response","GO:0002385","mucosal immune response"
"GO:0006955","Immune response","immune response","GO:0002386","immune response in mucosal-associated lymphoid tissue"
"GO:0006955","Immune response","immune response","GO:0002387","immune response in gut-associated lymphoid tissue"
"GO:0006955","Immune response","immune response","GO:0002388","immune response in Peyer's patch"
"GO:0006955","Immune response","immune response","GO:0002389","tolerance induction in Peyer's patch"
"GO:0006955","Immune response","immune response","GO:0002394","tolerance induction in gut-associated lymphoid tissue"
"GO:0006955","Immune response","immune response","GO:0002395","immune response in nasopharyngeal-associated lymphoid tissue"
"GO:0006955","Immune response","immune response","GO:0002400","tolerance induction in nasopharyngeal-associated lymphoid tissue"
"GO:0006955","Immune response","immune response","GO:0002401","tolerance induction in mucosal-associated lymphoid tissue"
"GO:0006955","Immune response","immune response","GO:0002402","B cell tolerance induction in mucosal-associated lymphoid tissue"
"GO:0006955","Immune response","immune response","GO:0002403","T cell tolerance induction in mucosal-associated lymphoid tissue"
"GO:0006955","Immune response","immune response","GO:0002404","antigen sampling in mucosal-associated lymphoid tissue"
"GO:0006955","Immune response","immune response","GO:0002405","antigen sampling by dendritic cells in mucosal-associated lymphoid tissue"
"GO:0006955","Immune response","immune response","GO:0002406","antigen sampling by M cells in mucosal-associated lymphoid tissue"
"GO:0006955","Immune response","immune response","GO:0002411","T cell tolerance induction to tumor cell"
"GO:0006955","Immune response","immune response","GO:0002412","antigen transcytosis by M cells in mucosal-associated lymphoid tissue"
"GO:0006955","Immune response","immune response","GO:0002413","tolerance induction to tumor cell"
"GO:0006955","Immune response","immune response","GO:0002415","immunoglobulin transcytosis in epithelial cells mediated by polymeric immunoglobulin receptor"
"GO:0006955","Immune response","immune response","GO:0002417","B cell antigen processing and presentation mediated by B cell receptor uptake of antigen"
"GO:0006955","Immune response","immune response","GO:0002418","immune response to tumor cell"
"GO:0006955","Immune response","immune response","GO:0002419","T cell mediated cytotoxicity directed against tumor cell target"
"GO:0006955","Immune response","immune response","GO:0002420","natural killer cell mediated cytotoxicity directed against tumor cell target"
"GO:0006955","Immune response","immune response","GO:0002421","B cell antigen processing and presentation following pinocytosis"
"GO:0006955","Immune response","immune response","GO:0002422","immune response in urogenital tract"
"GO:0006955","Immune response","immune response","GO:0002423","natural killer cell mediated immune response to tumor cell"
"GO:0006955","Immune response","immune response","GO:0002424","T cell mediated immune response to tumor cell"
"GO:0006955","Immune response","immune response","GO:0002425","tolerance induction in urogenital tract"
"GO:0006955","Immune response","immune response","GO:0002426","immunoglobulin production in mucosal tissue"
"GO:0006955","Immune response","immune response","GO:0002427","mucosal tolerance induction"
"GO:0006955","Immune response","immune response","GO:0002429","immune response-activating cell surface receptor signaling pathway"
"GO:0006955","Immune response","immune response","GO:0002430","complement receptor mediated signaling pathway"
"GO:0006955","Immune response","immune response","GO:0002431","Fc receptor mediated stimulatory signaling pathway"
"GO:0006955","Immune response","immune response","GO:0002433","immune response-regulating cell surface receptor signaling pathway involved in phagocytosis"
"GO:0006955","Immune response","immune response","GO:0002437","inflammatory response to antigenic stimulus"
"GO:0006955","Immune response","immune response","GO:0002438","acute inflammatory response to antigenic stimulus"
"GO:0006955","Immune response","immune response","GO:0002439","chronic inflammatory response to antigenic stimulus"
"GO:0006955","Immune response","immune response","GO:0002445","type II hypersensitivity"
"GO:0006955","Immune response","immune response","GO:0002450","B cell antigen processing and presentation"
"GO:0006955","Immune response","immune response","GO:0002451","peripheral B cell tolerance induction"
"GO:0006955","Immune response","immune response","GO:0002453","peripheral B cell anergy"
"GO:0006955","Immune response","immune response","GO:0002454","peripheral B cell deletion"
"GO:0006955","Immune response","immune response","GO:0002455","humoral immune response mediated by circulating immunoglobulin"
"GO:0006955","Immune response","immune response","GO:0002456","T cell mediated immunity"
"GO:0006955","Immune response","immune response","GO:0002457","T cell antigen processing and presentation"
"GO:0006955","Immune response","immune response","GO:0002458","peripheral T cell tolerance induction"
"GO:0006955","Immune response","immune response","GO:0002459","adaptive immune response based on somatic recombination of immune receptors built from leucine-rich repeat domains"
"GO:0006955","Immune response","immune response","GO:0002460","adaptive immune response based on somatic recombination of immune receptors built from immunoglobulin superfamily domains"
"GO:0006955","Immune response","immune response","GO:0002461","tolerance induction dependent upon immune response"
"GO:0006955","Immune response","immune response","GO:0002462","tolerance induction to nonself antigen"
"GO:0006955","Immune response","immune response","GO:0002463","central tolerance induction to nonself antigen"
"GO:0006955","Immune response","immune response","GO:0002464","peripheral tolerance induction to nonself antigen"
"GO:0006955","Immune response","immune response","GO:0002465","peripheral tolerance induction"
"GO:0006955","Immune response","immune response","GO:0002466","peripheral tolerance induction to self antigen"
"GO:0006955","Immune response","immune response","GO:0002467","germinal center formation"
"GO:0006955","Immune response","immune response","GO:0002522","leukocyte migration involved in immune response"
"GO:0006955","Immune response","immune response","GO:0002524","hypersensitivity"
"GO:0006955","Immune response","immune response","GO:0002552","serotonin secretion by mast cell"
"GO:0006955","Immune response","immune response","GO:0002553","histamine secretion by mast cell"
"GO:0006955","Immune response","immune response","GO:0002556","serotonin secretion by basophil"
"GO:0006955","Immune response","immune response","GO:0002557","histamine secretion by basophil"
"GO:0006955","Immune response","immune response","GO:0002558","type I hypersensitivity mediated by mast cells"
"GO:0006955","Immune response","immune response","GO:0002559","type I hypersensitivity mediated by basophils"
"GO:0006955","Immune response","immune response","GO:0002561","basophil degranulation"
"GO:0006955","Immune response","immune response","GO:0002622","regulation of B cell antigen processing and presentation"
"GO:0006955","Immune response","immune response","GO:0002623","negative regulation of B cell antigen processing and presentation"
"GO:0006955","Immune response","immune response","GO:0002624","positive regulation of B cell antigen processing and presentation"
"GO:0006955","Immune response","immune response","GO:0002625","regulation of T cell antigen processing and presentation"
"GO:0006955","Immune response","immune response","GO:0002626","negative regulation of T cell antigen processing and presentation"
"GO:0006955","Immune response","immune response","GO:0002627","positive regulation of T cell antigen processing and presentation"
"GO:0006955","Immune response","immune response","GO:0002634","regulation of germinal center formation"
"GO:0006955","Immune response","immune response","GO:0002635","negative regulation of germinal center formation"
"GO:0006955","Immune response","immune response","GO:0002636","positive regulation of germinal center formation"
"GO:0006955","Immune response","immune response","GO:0002652","regulation of tolerance induction dependent upon immune response"
"GO:0006955","Immune response","immune response","GO:0002653","negative regulation of tolerance induction dependent upon immune response"
"GO:0006955","Immune response","immune response","GO:0002654","positive regulation of tolerance induction dependent upon immune response"
"GO:0006955","Immune response","immune response","GO:0002655","regulation of tolerance induction to nonself antigen"
"GO:0006955","Immune response","immune response","GO:0002656","negative regulation of tolerance induction to nonself antigen"
"GO:0006955","Immune response","immune response","GO:0002657","positive regulation of tolerance induction to nonself antigen"
"GO:0006955","Immune response","immune response","GO:0002658","regulation of peripheral tolerance induction"
"GO:0006955","Immune response","immune response","GO:0002659","negative regulation of peripheral tolerance induction"
"GO:0006955","Immune response","immune response","GO:0002660","positive regulation of peripheral tolerance induction"
"GO:0006955","Immune response","immune response","GO:0002709","regulation of T cell mediated immunity"
"GO:0006955","Immune response","immune response","GO:0002710","negative regulation of T cell mediated immunity"
"GO:0006955","Immune response","immune response","GO:0002711","positive regulation of T cell mediated immunity"
"GO:0006955","Immune response","immune response","GO:0002712","regulation of B cell mediated immunity"
"GO:0006955","Immune response","immune response","GO:0002713","negative regulation of B cell mediated immunity"
"GO:0006955","Immune response","immune response","GO:0002714","positive regulation of B cell mediated immunity"
"GO:0006955","Immune response","immune response","GO:0002715","regulation of natural killer cell mediated immunity"
"GO:0006955","Immune response","immune response","GO:0002716","negative regulation of natural killer cell mediated immunity"
"GO:0006955","Immune response","immune response","GO:0002717","positive regulation of natural killer cell mediated immunity"
"GO:0006955","Immune response","immune response","GO:0002718","regulation of cytokine production involved in immune response"
"GO:0006955","Immune response","immune response","GO:0002719","negative regulation of cytokine production involved in immune response"
"GO:0006955","Immune response","immune response","GO:0002720","positive regulation of cytokine production involved in immune response"
"GO:0006955","Immune response","immune response","GO:0002721","regulation of B cell cytokine production"
"GO:0006955","Immune response","immune response","GO:0002722","negative regulation of B cell cytokine production"
"GO:0006955","Immune response","immune response","GO:0002723","positive regulation of B cell cytokine production"
"GO:0006955","Immune response","immune response","GO:0002724","regulation of T cell cytokine production"
"GO:0006955","Immune response","immune response","GO:0002725","negative regulation of T cell cytokine production"
"GO:0006955","Immune response","immune response","GO:0002726","positive regulation of T cell cytokine production"
"GO:0006955","Immune response","immune response","GO:0002727","regulation of natural killer cell cytokine production"
"GO:0006955","Immune response","immune response","GO:0002728","negative regulation of natural killer cell cytokine production"
"GO:0006955","Immune response","immune response","GO:0002729","positive regulation of natural killer cell cytokine production"
"GO:0006955","Immune response","immune response","GO:0002730","regulation of dendritic cell cytokine production"
"GO:0006955","Immune response","immune response","GO:0002731","negative regulation of dendritic cell cytokine production"
"GO:0006955","Immune response","immune response","GO:0002732","positive regulation of dendritic cell cytokine production"
"GO:0006955","Immune response","immune response","GO:0002733","regulation of myeloid dendritic cell cytokine production"
"GO:0006955","Immune response","immune response","GO:0002734","negative regulation of myeloid dendritic cell cytokine production"
"GO:0006955","Immune response","immune response","GO:0002735","positive regulation of myeloid dendritic cell cytokine production"
"GO:0006955","Immune response","immune response","GO:0002736","regulation of plasmacytoid dendritic cell cytokine production"
"GO:0006955","Immune response","immune response","GO:0002737","negative regulation of plasmacytoid dendritic cell cytokine production"
"GO:0006955","Immune response","immune response","GO:0002738","positive regulation of plasmacytoid dendritic cell cytokine production"
"GO:0006955","Immune response","immune response","GO:0002739","regulation of cytokine secretion involved in immune response"
"GO:0006955","Immune response","immune response","GO:0002740","negative regulation of cytokine secretion involved in immune response"
"GO:0006955","Immune response","immune response","GO:0002741","positive regulation of cytokine secretion involved in immune response"
"GO:0006955","Immune response","immune response","GO:0002742","regulation of cytokine biosynthetic process involved in immune response"
"GO:0006955","Immune response","immune response","GO:0002743","negative regulation of cytokine biosynthetic process involved in immune response"
"GO:0006955","Immune response","immune response","GO:0002744","positive regulation of cytokine biosynthetic process involved in immune response"
"GO:0006955","Immune response","immune response","GO:0002752","cell surface pattern recognition receptor signaling pathway"
"GO:0006955","Immune response","immune response","GO:0002757","immune response-activating signal transduction"
"GO:0006955","Immune response","immune response","GO:0002758","innate immune response-activating signal transduction"
"GO:0006955","Immune response","immune response","GO:0002759","regulation of antimicrobial humoral response"
"GO:0006955","Immune response","immune response","GO:0002760","positive regulation of antimicrobial humoral response"
"GO:0006955","Immune response","immune response","GO:0002764","immune response-regulating signaling pathway"
"GO:0006955","Immune response","immune response","GO:0002765","immune response-inhibiting signal transduction"
"GO:0006955","Immune response","immune response","GO:0002766","innate immune response-inhibiting signal transduction"
"GO:0006955","Immune response","immune response","GO:0002767","immune response-inhibiting cell surface receptor signaling pathway"
"GO:0006955","Immune response","immune response","GO:0002768","immune response-regulating cell surface receptor signaling pathway"
"GO:0006955","Immune response","immune response","GO:0002769","natural killer cell inhibitory signaling pathway"
"GO:0006955","Immune response","immune response","GO:0002770","T cell inhibitory signaling pathway"
"GO:0006955","Immune response","immune response","GO:0002771","inhibitory killer cell immunoglobulin-like receptor signaling pathway"
"GO:0006955","Immune response","immune response","GO:0002772","inhibitory C-type lectin receptor signaling pathway"
"GO:0006955","Immune response","immune response","GO:0002773","B cell inhibitory signaling pathway"
"GO:0006955","Immune response","immune response","GO:0002774","Fc receptor mediated inhibitory signaling pathway"
"GO:0006955","Immune response","immune response","GO:0002775","antimicrobial peptide production"
"GO:0006955","Immune response","immune response","GO:0002776","antimicrobial peptide secretion"
"GO:0006955","Immune response","immune response","GO:0002777","antimicrobial peptide biosynthetic process"
"GO:0006955","Immune response","immune response","GO:0002778","antibacterial peptide production"
"GO:0006955","Immune response","immune response","GO:0002779","antibacterial peptide secretion"
"GO:0006955","Immune response","immune response","GO:0002780","antibacterial peptide biosynthetic process"
"GO:0006955","Immune response","immune response","GO:0002781","antifungal peptide production"
"GO:0006955","Immune response","immune response","GO:0002782","antifungal peptide secretion"
"GO:0006955","Immune response","immune response","GO:0002783","antifungal peptide biosynthetic process"
"GO:0006955","Immune response","immune response","GO:0002784","regulation of antimicrobial peptide production"
"GO:0006955","Immune response","immune response","GO:0002785","negative regulation of antimicrobial peptide production"
"GO:0006955","Immune response","immune response","GO:0002786","regulation of antibacterial peptide production"
"GO:0006955","Immune response","immune response","GO:0002787","negative regulation of antibacterial peptide production"
"GO:0006955","Immune response","immune response","GO:0002788","regulation of antifungal peptide production"
"GO:0006955","Immune response","immune response","GO:0002789","negative regulation of antifungal peptide production"
"GO:0006955","Immune response","immune response","GO:0002794","regulation of antimicrobial peptide secretion"
"GO:0006955","Immune response","immune response","GO:0002795","negative regulation of antimicrobial peptide secretion"
"GO:0006955","Immune response","immune response","GO:0002796","positive regulation of antimicrobial peptide secretion"
"GO:0006955","Immune response","immune response","GO:0002797","regulation of antibacterial peptide secretion"
"GO:0006955","Immune response","immune response","GO:0002798","negative regulation of antibacterial peptide secretion"
"GO:0006955","Immune response","immune response","GO:0002799","positive regulation of antibacterial peptide secretion"
"GO:0006955","Immune response","immune response","GO:0002800","regulation of antifungal peptide secretion"
"GO:0006955","Immune response","immune response","GO:0002801","negative regulation of antifungal peptide secretion"
"GO:0006955","Immune response","immune response","GO:0002802","positive regulation of antifungal peptide secretion"
"GO:0006955","Immune response","immune response","GO:0002803","positive regulation of antibacterial peptide production"
"GO:0006955","Immune response","immune response","GO:0002804","positive regulation of antifungal peptide production"
"GO:0006955","Immune response","immune response","GO:0002805","regulation of antimicrobial peptide biosynthetic process"
"GO:0006955","Immune response","immune response","GO:0002806","negative regulation of antimicrobial peptide biosynthetic process"
"GO:0006955","Immune response","immune response","GO:0002807","positive regulation of antimicrobial peptide biosynthetic process"
"GO:0006955","Immune response","immune response","GO:0002808","regulation of antibacterial peptide biosynthetic process"
"GO:0006955","Immune response","immune response","GO:0002809","negative regulation of antibacterial peptide biosynthetic process"
"GO:0006955","Immune response","immune response","GO:0002810","regulation of antifungal peptide biosynthetic process"
"GO:0006955","Immune response","immune response","GO:0002811","negative regulation of antifungal peptide biosynthetic process"
"GO:0006955","Immune response","immune response","GO:0002812","biosynthetic process of antibacterial peptides active against Gram-negative bacteria"
"GO:0006955","Immune response","immune response","GO:0002813","regulation of biosynthetic process of antibacterial peptides active against Gram-negative bacteria"
"GO:0006955","Immune response","immune response","GO:0002814","negative regulation of biosynthetic process of antibacterial peptides active against Gram-negative bacteria"
"GO:0006955","Immune response","immune response","GO:0002815","biosynthetic process of antibacterial peptides active against Gram-positive bacteria"
"GO:0006955","Immune response","immune response","GO:0002816","regulation of biosynthetic process of antibacterial peptides active against Gram-positive bacteria"
"GO:0006955","Immune response","immune response","GO:0002817","negative regulation of biosynthetic process of antibacterial peptides active against Gram-positive bacteria"
"GO:0006955","Immune response","immune response","GO:0002819","regulation of adaptive immune response"
"GO:0006955","Immune response","immune response","GO:0002820","negative regulation of adaptive immune response"
"GO:0006955","Immune response","immune response","GO:0002821","positive regulation of adaptive immune response"
"GO:0006955","Immune response","immune response","GO:0002822","regulation of adaptive immune response based on somatic recombination of immune receptors built from immunoglobulin superfamily domains"
"GO:0006955","Immune response","immune response","GO:0002823","negative regulation of adaptive immune response based on somatic recombination of immune receptors built from immunoglobulin superfamily domains"
"GO:0006955","Immune response","immune response","GO:0002824","positive regulation of adaptive immune response based on somatic recombination of immune receptors built from immunoglobulin superfamily domains"
"GO:0006955","Immune response","immune response","GO:0002825","regulation of T-helper 1 type immune response"
"GO:0006955","Immune response","immune response","GO:0002826","negative regulation of T-helper 1 type immune response"
"GO:0006955","Immune response","immune response","GO:0002827","positive regulation of T-helper 1 type immune response"
"GO:0006955","Immune response","immune response","GO:0002828","regulation of type 2 immune response"
"GO:0006955","Immune response","immune response","GO:0002829","negative regulation of type 2 immune response"
"GO:0006955","Immune response","immune response","GO:0002830","positive regulation of type 2 immune response"
"GO:0006955","Immune response","immune response","GO:0002837","regulation of immune response to tumor cell"
"GO:0006955","Immune response","immune response","GO:0002838","negative regulation of immune response to tumor cell"
"GO:0006955","Immune response","immune response","GO:0002839","positive regulation of immune response to tumor cell"
"GO:0006955","Immune response","immune response","GO:0002840","regulation of T cell mediated immune response to tumor cell"
"GO:0006955","Immune response","immune response","GO:0002841","negative regulation of T cell mediated immune response to tumor cell"
"GO:0006955","Immune response","immune response","GO:0002842","positive regulation of T cell mediated immune response to tumor cell"
"GO:0006955","Immune response","immune response","GO:0002843","regulation of tolerance induction to tumor cell"
"GO:0006955","Immune response","immune response","GO:0002844","negative regulation of tolerance induction to tumor cell"
"GO:0006955","Immune response","immune response","GO:0002845","positive regulation of tolerance induction to tumor cell"
"GO:0006955","Immune response","immune response","GO:0002846","regulation of T cell tolerance induction to tumor cell"
"GO:0006955","Immune response","immune response","GO:0002847","negative regulation of T cell tolerance induction to tumor cell"
"GO:0006955","Immune response","immune response","GO:0002848","positive regulation of T cell tolerance induction to tumor cell"
"GO:0006955","Immune response","immune response","GO:0002849","regulation of peripheral T cell tolerance induction"
"GO:0006955","Immune response","immune response","GO:0002850","negative regulation of peripheral T cell tolerance induction"
"GO:0006955","Immune response","immune response","GO:0002851","positive regulation of peripheral T cell tolerance induction"
"GO:0006955","Immune response","immune response","GO:0002852","regulation of T cell mediated cytotoxicity directed against tumor cell target"
"GO:0006955","Immune response","immune response","GO:0002853","negative regulation of T cell mediated cytotoxicity directed against tumor cell target"
"GO:0006955","Immune response","immune response","GO:0002854","positive regulation of T cell mediated cytotoxicity directed against tumor cell target"
"GO:0006955","Immune response","immune response","GO:0002855","regulation of natural killer cell mediated immune response to tumor cell"
